{
  "$schema": "./images-index.schema.json",
  "version": "0.1",
  "description": "Manifest of raster images (backgrounds, banners, dividers, demo logos).",
  "images": [],
  "gaps": [
    "add 3 neutral gradient backgrounds (1920x1080 WebP) for executive style",
    "add 2 banner strips (1920x128) for page headers",
    "add placeholder demo-customer logos (never real customer marks)"
  ]
}
